tcpdump: verbose output suppressed, use -v[v]... for full protocol decode
listening on eth0, link-type EN10MB (Ethernet), snapshot length 262144 bytes
20:46:42.563878 IP 143.110.220.137.22 > 162.243.190.66.60397: Flags [P.], seq 3947772104:3947772168, ack 809686917, win 502, options [nop,nop,TS val 1687977599 ecr 1755324965], length 64
20:46:42.564182 IP 162.243.190.66.60397 > 143.110.220.137.22: Flags [.], ack 64, win 501, options [nop,nop,TS val 1755324969 ecr 1687977599], length 0
20:46:42.565427 IP 143.110.220.137.22 > 162.243.190.66.60397: Flags [P.], seq 64:192, ack 1, win 502, options [nop,nop,TS val 1687977601 ecr 1755324969], length 128
20:46:42.565478 IP 143.110.220.137.22 > 162.243.190.66.60397: Flags [P.], seq 192:256, ack 1, win 502, options [nop,nop,TS val 1687977601 ecr 1755324969], length 64
20:46:42.565510 IP 143.110.220.137.22 > 162.243.190.66.60397: Flags [P.], seq 256:336, ack 1, win 502, options [nop,nop,TS val 1687977601 ecr 1755324969], length 80
5 packets captured
29 packets received by filter
0 packets dropped by kernel