tcpdump: verbose output suppressed, use -v[v]... for full protocol decode
listening on eth0, link-type EN10MB (Ethernet), snapshot length 262144 bytes
20:47:18.687972 IP lamponubuntu2204-s-1vcpu-1gb-tor1-01.ssh > 162.243.190.66.60397: Flags [P.], seq 3947776264:3947776392, ack 809688421, win 502, options [nop,nop,TS val 1688013723 ecr 1755361088], length 128
20:47:18.688047 IP lamponubuntu2204-s-1vcpu-1gb-tor1-01.ssh > 162.243.190.66.60397: Flags [P.], seq 128:192, ack 1, win 502, options [nop,nop,TS val 1688013724 ecr 1755361088], length 64
20:47:18.688098 IP lamponubuntu2204-s-1vcpu-1gb-tor1-01.ssh > 162.243.190.66.60397: Flags [P.], seq 192:272, ack 1, win 502, options [nop,nop,TS val 1688013724 ecr 1755361088], length 80
20:47:18.688143 IP lamponubuntu2204-s-1vcpu-1gb-tor1-01.ssh > 162.243.190.66.60397: Flags [P.], seq 272:352, ack 1, win 502, options [nop,nop,TS val 1688013724 ecr 1755361088], length 80
20:47:18.688186 IP lamponubuntu2204-s-1vcpu-1gb-tor1-01.ssh > 162.243.190.66.60397: Flags [P.], seq 352:432, ack 1, win 502, options [nop,nop,TS val 1688013724 ecr 1755361088], length 80
5 packets captured
36 packets received by filter
0 packets dropped by kernel